id,name,description,price,name_hash,description_hash,price_hash
829,"Аппарат 4 в 1 CRYO360 (металл) криолиполиз, RF, кавитация, электромагнитная миостимуляция","  Мультифункциональный комбайн 4 в 1 CRYO360 в металлическом корпусе позволяет проводить как отдельные процедуры для коррекции фигуры, так и составлять комплексные программы похудения, которые гарантируют вашему клиенту видимые результаты.  Функции аппарата:  -криолиполиз 2 манипулы для работы по телу + 1 манипула для зоны подбородка -кавитация -Радиолифтинг 2 манипулы для работы по лицу и телу -Электромиостимуляция ( <span lang=""EN"">HIEMT  )    Криолиполиз -  воздействие холодом на жировые ловушки, в результате чего жировые клетки разрушаются, а продукты распада затем постепенно выводятся из организма естественным путем. Результат от процедуры наступает в течение 2-8 недель, именно столько времени нужно организму для выведения продуктов распада. Объём жировой ткани в зоне воздействия может уменьшиться на 25% за одну процедуру, а за 2 процедуры - на 45-50%. В данном аппарате 3 манипулы криолиполиза разного размера и несколько съемных насадок.    Кавитация - безоперационная липосакция. Популярная и безболезненная процедура для локального уменьшения жировых отложений. Через манипулу аппарата проходит ультразвуковая волна, которая разрушает клеточную мембрану, жир под давлением превращается в жидкость и выводится из организма естественным путем - через лимфосистему. За одну процедуру уходят объемы до 4 см!    Радиолифтинг - одна из лучших аппаратных методик для подтяжки кожи. Аппарат воздеиствует на кожу радиочастотными волнами, которые проникают вглубь тканеи и нагревают их структурные компоненты. Под воздеиствием тепла наблюдается эффект коагуляции - белковые волокна коллагена и эластина сжимаются и уплотняются, обеспечивая моментальныи лифтинг и разглаживание имеющихся морщин. Кроме этого радиолифтинг выравнивает тон и улучшает тургор кожи, а еще за счет прогрева оказывается опосредованное липолитическое воздействие. В данном аппарате 2 манипулы радиолифтинга: малая для лица и большая для тела.    Электромагнитная миостимуляция - -  высокоэффективная, нетравматичная ""ленивая"" тренировка, которая работает на наращивание мышц и жиросжигание. В основе метода лежит воздействие высокоинтенсивной сфокусированной электромагнитной волной, что приводит к активному сокращению и расширению мышечных волокон и увеличению мышечной ткани. Процесс мышечного сокращения, в свою очередь, стимулирует процесс жиросжигания: жировые кислоты расщепляются, а продукты распада выводятся естественным путем в течение нескольких недель.  ",350000.00,e2280f2c9abff323a5e9c6996e9cde32,727bc5f7b43ef3feaf8b81c7c8d267ba,53509e431799d816b96a12775df034d8
830,"Аппарат 4 в 1 CR360 криолиполиз, RF, кавитация, фотолиполиз"," Аппарат 4 в 1 CR360 позволяет проводить как отдельные процедуры для коррекции фигуры, так и составлять комплексные программы похудения, которые гарантируют вашему клиенту видимые результаты.  Функции аппарата:  Криолиполиз - - воздействие холодом на жировые ловушки, в результате чего жировые клетки разрушаются, а продукты распада затем постепенно выводятся из организма естественным путем. Результат от процедуры наступает в течение 2-8 недель, именно столько времени нужно организму для выведения продуктов распада. Объём жировой ткани в зоне воздействия может уменьшиться на 25% за одну процедуру, а за 2 процедуры - на 45-50%. В данном аппарате 5 манипул криолиполиза разного размера и большой ассортимент съемных насадок. Кавитация - безоперационная липосакция. Популярная и безболезненная процедура для локального уменьшения жировых отложений. Через манипулу аппарата проходит ультразвуковая волна, которая разрушает клеточную мембрану, жир под давлением превращается в жидкость и выводится из организма естественным путем - через лимфосистему. За одну процедуру уходят объемы до 4 см! Радиолифтинг - одна из лучших аппаратных методик для подтяжки кожи. Аппарат воздеиствует на кожу радиочастотными волнами, которые проникают вглубь тканеи и нагревают их структурные компоненты. Под воздеиствием тепла наблюдается эффект коагуляции - белковые волокна коллагена и эластина сжимаются и уплотняются, обеспечивая моментальныи лифтинг и разглаживание имеющихся морщин. Кроме этого радиолифтинг выравнивает тон и улучшает тургор кожи, а еще за счет прогрева оказывается опосредованное липолитическое воздействие. В данном аппарате 2 манипулы радиолифтинга: малая для лица и большая для тела. Лаполазер. Секрет действия липолазера состоит в применении низкоинтенсивного лазерного излучения, которое воздействует на проблемные зоны. Лазерное излучение проникает на глубину, в которой расположены клетки жировой ткани, и увеличивает проницаемость клеточных мембран, в которых образуются так называемые поры, через которые содержимое клеток переходит в межклеточное пространство. Активизируются биохимические ферментативные реакции, в результате которых жиры расщепляются на отдельные элементы: глицерин и жирные кислоты.  Важно, что лазерный луч избирательно воздействует именно на места скопления адипоцитов и не затрагивает никакие другие ткани и структуры. Продукты расщепления же используются в качестве источника энергии и естественным физиологическим путем выводится из организма через лимфатическую систему и печень. В комплекте 6 больших пластин для тела и 2 малые пластины для лица. ",300000.00,d2fb90d26c187f4bc4d503f9ef3e8f3a,c606ab17a5e34a03324a42fc74639ead,2cc1edc04e43cf2fd631135f48bdcee2
831,Аппарат 2 в 1 S13 (криолиполиз тело + зона подбородка)," Аппарат криолиполиза 2 в 1 S13 - - это настольная компактная модель с 3 манипулами для разных зон: большая и средняя для тела, малая для второго подбородка. -  Жировые клетки больше подвержены воздействию низких температур, чем клетки соседних тканей. При охлаждении кожи до -5С&deg; адипоциты кристаллизуются, и наступает их энергетическое голодание. При этом обморожения соседних тканей не происходит. Начинается процесс апоптоза- естественной гибели жировых клеток. Они разрушаются не одномоментно, а в течение 1-2 месяцев после охлаждения. Процедура криолиполиза длится в среднем 60 минут. Вакуумная насадка засасывает жировую складку на теле пациента в чашу, где происходит процесс охлаждения. Криолиполиз -это современная косметологическая процедура, подразумевающая неинвазивную коррекцию фигуры. Принцип действия  Клетки жира, или адипоциты, не похожи на другие ткани нашего организма: они являются неустойчивыми к продолжительному воздействию отрицательной температуры. Предназначение данных клеток заключается в том, что они запасают многие ценные для человеческого тела вещества (в случае переизбытка таковых), а в экстремальных ситуациях отдают накопления для выработки энергии. Явным плюсом этого метода является то, что соседние с жиром ткани устойчивы к холоду, и воздействие пониженных температур во время процедуры не приносит им вреда. Ведь в аппарате для криолиполиза все продумано и непредвиденного обморожения кожи случиться не может - - этому помешает контролирующая система.  Как проводится процедура  Как правило, для отдельного участка тела хватает одного-трех сеансов. Во время сеанса пациент садится или ложится на кушетку. На выбранную для проведения процедуры зону кладется салфетка, предварительно смазанная специальным гелем. Затем на этот участок устанавливают аппликатор с вакуумной насадкой или без нее. При использовании насадки в нее под действием вакуума попадает складка кожи, которая требует удаления жира.  К зафиксированной кожной складке с обеих сторон прикладывают охлаждающие элементы, под влиянием которых температура тканей падает. Вакуум удерживает жировую складку 40-60 минут: именно за это время погибают клетки, образующие жировую клетчатку. После окончания сеанса насадку отсоединяют, салфетку убирают и вытирают гель.  Чтобы кожа адаптировалась к обычной температуре и в целях нормализации кровоснабжения специалист проводит массаж обработанной зоны. На этом процедура заканчивается, и клиент может сразу идти по своим делам. Расщепление жировых клеток происходит не сразу. Эффективность криолиполиза обычно можно заметить через 2-4 месяца после сеанса. Через 2 месяца объем жировой прослойки уменьшается на 20%, через 4 месяца - - на 40%.  Показания для криолиполиза  Криолиполиз может рассматриваться как отдельная процедура, направленная на коррекцию фигуры, либо как составляющая комплексной программы, включающей в себя мезотерапию (инъекции для подтяжки кожи и удаления жира), ультразвуковую кавитацию, лимфодренажный массаж или радиолифтинг, диеты и занятия спортом. Криолиполиз показан, в первую очередь, людям, желающим изменить пропорции фигуры, поскольку при этой процедуре можно убирать жир локально.  Чаще всего коррекция проводится на следующих  ;проблемных ; зонах:  - низ живота; - бока; - бедра (по желанию можно убрать жировые отложения в виде галифе);ягодицы; Не проводят криолиполиз на лице (исключение - - криолиполиз второго подбородка, для которого используется специальная насадка), на шее и в зоне декольте. Также процедура не применяется при малой толщине подкожного жира - - менее одного сантиметра.  Частота проведения процедуры криолиполиза:  Бывают случаи, когда для удаления жира с участка тела нужно провести не один сеанс, а два или три. В этом случае минимальный разрыв между процедурами должен составлять два месяца.  Номер сертификата соответствия  № РОСС CN.HB61.H29322  Номер декларации соответствия ЕАЭС N RU Д-CN.РА01.В.56589/21    ",190000.00,0a08750a3400f9a3606d551f52ccf1a7,81fdd9e77bc3430f0a5e9f17e76077a6,4ec54bf3d4e9f62ac4afd4ebdd4bedf8
832,"Аппарат 2 в 1 С3850 криолиполиз, виброкомпрессионный массаж","Две эффективные методики для коррекции фигуры и борьбы с локальными жировыми отложениями: криолиполиз + виброкомпрессионный роликовый массаж в аппарате 2 в 1 С3850. Комбинированный аппарат C3850 виброкомпрессионного массажа и методику криолиполиза, позволяющую избавиться от жировых отложений под воздействием холода, при помощи технологии охлаждения на 360&deg;. Локальное охлаждение жировых складок позволяет естественным способом.  Методика виброкомпрессионного массажа это безопасная коррекция фигуры-такова общая концепция методики. Массаж осуществляется цилиндром и силиконовыми сферами, создающими  ;эффект помпы ;. Частота вращения сфер до 355 Гц создает нужную силу воздействия и  ;контролирует ; ощущения во время процедуры. За давление на кожу отвечают специальные ролики, обладающие эффектом лимфодренажа. Аппарат отлично  ;чувствует ; тело: он будто подстраивается под него, не оставляя следов и не вызывая аллергических реакций. Аппарат одновременно улучшает микроциркуляцию, разглаживает морщины, клетки кожи насыщаются кислородом, запускается процесс регенерации. Быстрое неинвазивное и эффективное уменьшение объемов, укрепление мышечного тонуса и подтяжка кожи. -  Две рабочие рукоятки для лица и тела Сенсорный дисплей Не требует контактной среды (масла), процедура проводится по индивидуальному костюму Инновационная работа рукоятки с микророликами из силикона  Показания:  Целлюлит; Дряблость кожи; Пониженный тонус кожи; Избыток жировых отложений; Синдром ""усталых ног"" (отеки); Восстановление после физических нагрузок.",470000.00,add4c9c7d9c25377df7ec6bdc52e0194,52aab8441761002c5914d346a902752f,0d80658e7d85f075adbba045d7f47798
833,Аппарат 2 в 1  NV-108 (алмазная микродермабразия+вакуумный лифтинг)," Аппарат микродермабразии работает от сети, компактный с большим набором сменных насадок. В наборе 2 ручки-держатели и 9 сменных шлифовальных насадок разного диаметра. Дополнителько в аппарате есть функция спрей. Для вакуумного массажа можно дополнительно приобрести массажные банки любого диаметра, и проводить вакуумный массаж лица.  Функции аппарата:  -Алмазный пилинг (микродермабразия) -Спрей -Вакуумная чистка  Преимущества микродермабразии:   Алмазная микродермабразия проводится на лице, шее, бюсте и на других участках тела при любом типе кожи. Процедура алмазной микродермабразии безболезненна и не имеет побочных эффектов.  Клиент сразу может после процедуры приступать к активной жизни.  Специальный набор алмазных головок разной величины обеспечивает необходимый уход при любом типе кожи и в самых деликатных местах (веки, крылья носа).  Процедура позволяет добиться мягкой как шелк, здоровой кожи.  Достигается стойкий эффект при шлифовке рубцов и растяжек.  Показания к алмазному пилингу:  чистка кожи от старых клеток, чистка жирной и пористой кожи, а также нормальной и сухой.  ревитализация кожи, её обновление и восстановление  отбеливание пигментных пятен  морщины различной глубины  акне, комедоны, утолщения эпидермиса  различные рубцы после травм и операций (лиц и тело)  уменьшение последствий постакне  придание свежести лицу: нездоровая, тусклая и бугристая кожа становится ""светящейся"" и гладкой  омоложение кожи и профилактика старения кожи  выравнивание рельефа кожи  уменьшение растяжек на теле.  Комплектация аппарата микродермабразии:   Аппарат дермабразии - 1 шт.  Две ручки-держатели и 9 насадок для шлифовки разного калибра, сменные фильтры.  Ёмкость для спрея.  Шнур питания - 1 шт.  Инструкция - 1 шт.  Номер сертификата соответствия  № РООС CN.HE06.H19534 действителен до 25.02.2027 года  ",9900.00,76f18d590aff620e071263de58e407b6,441d321c088c5a5502fcdd368fa1c4b5,7416746e26d7fce3fa8fa616be93dc0a
834,Аппарат микродермабразия  NV-60," Аппарат -  NV-60  разработан для выполнения глубокого механического пилинга, что позволяет проводить комплексную процедуру омоложения. Микродермабразия решает ряд эстетических проблем:   - Способствует разглаживанию мелких морщин, растяжек, лечению акне, избавляет от небольших отеков. - Стимулирует регенерацию клеток дермы. Это помогает очистить огрубевшую кожу и загрязненные поры. Также решаются проблемы милиумов и себорейного дерматита. - Восстанавливает секреторную функцию сальных желез, избавляет от жирного блеска, бактерий и токсинов. Технология предусматривает поэтапное очищение слоев кожи. - За счет массажа ускоряется обмен веществ, так как усиливается кровообращение. По той же причине разглаживаются морщины и стрии. Через несколько сеансов кожа начинает синтезировать собственный коллаген, повышается защита от влияния негативных факторов окружающей среды.  Номер сертификата соответствия  № РОСС CN.HB61.H29322 Номер декларации соответствия ЕАЭС N RU Д-CN.РА01.В.56589/21  ",12000.00,2740d5f50416bae42a8adac8d46734af,0a24b9da49d4af9a94213eabe3241493,70a6c2fe552210690c1817fdc52fac80
