id,name,description,price,name_hash,description_hash,price_hash
942,Аппарат 8 в 1 Alice Superbubble Max, Обновленный хит 2024 года!  Мнофункциональный аппарат это восьмиступенчатая усовершенствованная система омоложения и очищения - с функцией безинъекционной карбокситерапии.  Функции косметологического комбайна:  1.Вакуумный гидропилинг 2.Фонофорез  3.Кислородная кисть (Спреер) 4.Алмазная микродермабразия 5.Криотерапия/термотерапия 6. Манипула триполярная микротоковая терапия 7.УЗ чистка 8.Профессиональная неинвазивная карбокситерапия  Номер сертификата соответствия  № РОСС CN.HB61.H29322  Номер декларации соответствия ЕАЭС N RU Д-CN.РА01.В.56589/21 ,155000.00,e515738fbdf1358fe8644271e4445dcd,b525778ef01918e22b1d81e3018eb0f5,0c6291bba864a5e9fcc1d80341b8b365
943,"Аппарат 9 в 1 Micros 7D (RF, микротоки, вакуум массаж, криотерапия, УЗ, электропорация,Спреер)","Главным преимуществом данного комбайна является отличное сочетание цены оборудования и его мультифункциональности. Аппарат оснащен одними из самых востребованных функций для ухода за лицом и телом.  Функции аппарата:  1. RF-терапия  - Эффективный способ борьбы со старением кожи. Омолаживает,подтягивает кожу за счет молекулярного воздействия радиочастот на ткани за счет их прогрева. Создаваемая температура в тканях, восстанавливает терморегуляцию, которая исправляет нарушения физиологических функций тканей, насыщает ткани кислородом, ускоряет метаболизм, быстрее выводит продукты обмена, стимулирует синтез коллаген и эластина. 2. М икротоки (2 манипулы и пассивный электрод)  - - Дает потрясающие эффекты при борьбе с возрастными изменениями. 3. Электропорация - -  Функция, способна в десятки раз увеличить проникновение лечебных и питательных веществ в глубокие кожные слои. 4.спреер  (кислородная кисть)  - Насыщение и увлажнение кожи питательными сыворотками. 5. Вакуумный массаж -  Эффективно воздействует на кожу, улучшая ее состояние и внешний вид. Ускоряя лимфоток, она помогает бороться с отеками, локальными жировыми отложениями в проблемных зонах.  6.Микродермабразия - Алмазная дермабразия представляет собой микрошлифовку кожи, основанную на использовании аппарата вакуумного всасывания с алмазными насадками. Процедура проводится при любом типе кожи и применяется для выравнивания кожи лица, шеи, области декольте и других участков тела. Кроме того, дермабразия эффективна при растяжках, рубцах и различных уплотнениях верхних слоев эпидермиса. 7. Криотерапия  - Благоприятно влияет на тонус кожи. Данный этап подразумевает охлаждение кожного покрова-криотерапию. Низкие температуры способствуют резкому сужению пор, которое продлевает действие компонентов введенных препаратов. 8. Ультразвуковая чистка  - Предназначена для очищения кожного покрова от ороговевших чешуек с применением ультразвуковых волн. Отшелушиваются ороговевшие слои эпидермиса. Также с кожного покрова и сально-волосяных протоков удаляются остатки косметических средств. 9. Фонофорез  - Под воздействием ультразвука косметические препараты проникают в более глубокие слои кожи. Часто бывает, что поры у человека забиваются, или просто их проницаемость не достаточно велика. Да и далеко не весь крем, который мы наносим, хорошо впитывается кожей. При применении ультрафонофореза косметика впитывается лучше и эффект от ее применения куда заметнее.  Номер сертификата соответствия  № РОСС CN.HB61.H29322  Номер декларации соответствия ЕАЭС N RU Д-CN.РА01.В.56589/21  ",59000.00,304f024eb6abb9dec17e99ca6fd9c6d0,ce4c38205f8b05d792466cc4b60aaef9,3d3a7957ae0a300a5232a673b63c5362
944,"Аппарат 17 в 1 NV-WA16 УЗ, RF, LED, гидропилинг, фонофорез, микротоки, дарсонваль"," 17 в 1 NV-WA16 - многофункциональный комбайн для косметолога!   <em>Под заказ. Уточняйте подробности у менеджера. </em> В нем есть ВСЕ, что потребуется вам для эффективной работы: 1. Гидропилинг  (аквапилинг) Глубокое очищение кожи с помощью струи воды и специальных растворов, удаление отмерших клеток и излишков кожного сала. 2. Спреер  (кислородная кисть) Особенно популярен у обладателей сухого типа кожи, поскольку с его помощью можно подарить коже недостающую влагу. Так же, функция удобна для распыления сывороток, лосьонов на водной основе, для дальнейшего использования других функций.  Например: распылить на кожу пациента сыворотку для фонофореза, и далее произвести процедуру согласно протокола. 3. Микротоки  ;Луна ;:  Стимуляция клеток кожи микротоками для улучшения ее тонуса, упругости и эластичности, разглаживания морщин и овала лица. 4. Пятиполярные микротоки:  Такие импульсы мягко и эффективно воздействуют на эпидермис, дерму, подкожно-жировую клетчатку, сосудистую сеть, мышцы и создают условия для синтеза новых коллагеновых и эластиновых волокон. Так же в манипуле встроена функция LED фотон в 3х спектрах красный, синий и зеленый свет. 5. Микротоки массажер  по телу 6. Фонофорез:  Ультразвуковая терапия для глубокого проникновения косметических средств, улучшения микроциркуляции и метаболизма. 7. Фонофорез для области вокруг глаз : Введение лечебных косметических средств в глубокие слои дермы под воздействием ультразвука. 8.Ультразвуковой скрабер: Ультразвуковая чистка кожи для удаления черных точек, угрей и других несовершенств. 9. Криотерапия  Функция  ;холод ; специально разработана для успокоения кожи после пилинга и других агрессивных процедур. 10.Карбокситерапия Это сочетание 2-х методик для эффективного и комфортного омоложения и оздоровления кожи. Карбокситерапия-оксигенация кожи изнутри, очистка, обогащение натуральными ингредиентами. Миофасциальный аппаратный массаж (силиконовая насадка) для стимуляции лимфооттока, снижения отечности и тренировки мышц лица, для поддержания их тонуса 11. Фракционная мезотерапия  представляет собой аппарат, с помощью которого проводится микроигольчатая терапия, направленная на восстановления коллагенового каркаса кожи за счет частичного повреждения.  На конце ручки находится сменная насадка с микроиглами. Во время процедуры аппарат производит проколы, они делаются выборочно, а между микроповреждениями остаются нетронутые зоны. В результате прокалывания выбранной области начинается активная выработка коллагена и эластина, а также стимулируются естественные процессы регенерации, в результате чего улучшается внешний вид и состояние кожи. 6 режимов скорости и регулируемая глубина проникновения до 2,5 мм 12. Алмазная шлифовка : Процедура заключается в мягкой шлифовке ороговевшего слоя кожи при помощи оксида алюминия в виде микрокристаллов, подающихся под высоким давлением. 13. Дарсонваль -озонотерапия : Озонотерапия применяется в косметологии с целью лечения и профилактики различных косметологических проблем. Улучшение цвета лица, противовоспалительное действие, для чувствительной кожи. 14. Коагулятор : C помощью него производится прижигание кожной ткани переменным током высокой частоты, генерирует высокочастотный электрический ток, вызывающий нагревание и разрез тканей в том месте, где соприкасаются активный электрод и ткань. 15. Дарсонваль : Используется для физиотерапии и косметических процедур. С помощью импульсного переменного тока прибор расширяет кровеносные сосуды, улучшает кровообращение и питание тканей кожи и слизистой, а также волос. 16. Биполярный RF лифтинг : Радиоволновой лифтинг - омоложение эпидермиса без хирургического вмешательства благодаря радиоволнам. Активные RF - импульсы активизируют фибробласты (ткани кожи) вырабатывать природный коллаген и эластин стимулирует естественные реакции реструктуризации эпидермиса. Влияние на кожные капилляры, удаляя лишнюю жидкость и усиливая кровообращение. Дает возможность снизить утомленность и отечность, убрать темные круги вокруг глазам, повышая тонус и гладкость кожи. 17. Led терапия  для лица и тела (красный, синий, зеленый, желтый, фиолетовый спектры цвета) ",190000.00,32adf0c8a1423b3407456c799ef97ef4,6999aec8edee9fc3ecbe81f49d2966c7,4ec54bf3d4e9f62ac4afd4ebdd4bedf8
945,"Аппарат 3 в 1 AQUASURE Н2 (гидропилинг, микротоки, окситерапия)"," Апарат представляет собой мультифункциональную высокотехнологическую платформу для комплексного воздействия на кожу. Процедуры на аппарате AQUASURE H2 могут выполняться как комплексно все этапы лечения, так и отдельными этапами для потребностей и клинического результата конкретного клиента. Функции аппарата:  1.Вакуумный Гидропилинг. 2.Микротоки 3.Окситерапия.  Комплектация аппарата:  1.Основной блок управления 2.Манипула гидропилинга + Сменные насадки для гидропилинга 7 шт. 3.Микротоки роллер с негативным электродом 4.Кабель электропитания 5.Держатель для манипул 6.Фильтр<span style=""font-family: arial black,avant garde;""> Основные результаты воздействия гидропилинга:  -Эффективное устранение основных признаков старения кожи; -Удаление кератиновых остатков с поверхности кожи; -Очищение, питание и увлажнение кожи,удаление из кожи свободных радикалов; -Усиление восстановительных процессов в коже; -Устранение камедонов, нормализация пор, лечение акне; -Лифтинг и тонизация кожи (уменьшение морщин, запуск неоколлагеногенеза); -Осветление кожи (в том числе снижение выработки меланина в динамике); -Усиление активности обменных процессов в коже-значительно более сильные результаты применения других процедур и космецевтики на фоне воздействия AQUASURE H2.  Окситерапия  - - это методика насыщения клеток кожи кислородом, влагой и питательными веществами. Наполнение влагой и кислородом повышает проницаемость клеточных мембран, благодаря чему активные вещества лучше впитываются. Таким образом удается достичь того же эффекта, что и при мезотерапии. Процедура выполняется манипулой гидропилинга. Само по себе наполнение кожи влагой и кислородом способствует повышению тургора кожи и лифтингу. Этапы комплексной процедуры AQUASURE H2:  1. Водородный пилинг-тонизация:  -предварительное водородное увлажнение,  -водородный пилинг-дренаж.  2. Вакуумный водно-кислотный пилинг.  3. Очищение кожи с салициловой и бета-гидрокси кислотами. 4. Насыщение кожи витаминной питающей сывороткой. 5. Микротоковая терапия  Гидропилинг  <span style=""font-family: book antiqua,palatino;""><span style=""font-size: xx-small;""><span style=""font-family: arial,helvetica,sans-serif;"">С помощью вакуума, специальная насадка со спиральным наконечником размягчает, отшелушивает и поглощает загрязнения. Через эту же насадку на кожу подаются сыворотки, которые увлажняют, очищают или питают кожу. Процесс пилинга будет деликатным, проводится при помощи силиконовых наконечников, разной степени абразивности и размера. Это аппаратная неинвазивная методика, которая сочетает в себе глубокое очищение, увлажнение, питание и омоложение кожи. Подходит для любого типа кожи вне зависимости от возраста. Процедура сочетается со всеми косметологическими процедурами, а также вакуумный гидропилинг можно проводить в любое время года (после использования наноситься SPF). Сыворотки подбираются косметологом в зависимости от проблемы. Применение может быть направлено на: осветление пигментации, лечение акне, коррекцию возрастных изменений.    _x000D_
 <span style=""font-family: book antiqua,palatino;""> <span style=""font-size: xx-small;"">Для достижения максимально эффекта , этап очищения кожи должен содержать фруктовые кислоты или салициловую кислоты в нужной , щадящей концентрации.     При работе - миктротоковым  роллером на кожу лица - обеспечивает разглаживание морщин, подтяжку кожи и лифтинг эффект.  Номер сертификата соответствия  № РОСС CN.HB61.H29322  Номер декларации соответствия ЕАЭС N RU Д-CN.РА01.В.56589/21   ",43000.00,e111647c38d51ec905b82a59a87befd7,218d9f859348c80aca3c9c412dce40b5,6414ae39e52ba808959b17ba1b1facd3
