id,name,description,price,name_hash,description_hash,price_hash
738,Аппарат Velashape Sculptor," Velashape - Сочетание - роликового массажа с повторяющимся ритмом становится возможна эффективная проработка кортикальной ткани, жировой клетчатки, технология глубокого всасывания позволяет воздействовать на глубокие подкожные ткани. Кроме того, такой массаж стимулирует работу лимфатической и кровеносной систем. - Результат-уменьшение целлюлита и улучшение распределения жировых отложений. Данные процедуры позволяют восстановить эластичность кожи и эффективно уменьшить морщины/ Отличительной особенностью  аппарата Sculptor является применение технологии сочетания рф-лифтинга с ИК прогервом. -  Каждая из насадок имеет свою область применения:  Большая насадка   для тела для проведения вакуумно-роликового массажа. Она оснащена функцией РФ-лифтинга (1МГЦ), функцией инфракрасной фотонотерапии и имеет регулированную мощность. Роллеры насадки снабжены моторчиками и двигаются в 4-х направлениях.  Насадка (роллер) для лица   позволяет максимально эффективно моделировать контуры подбородка и лица клиента благодаря одновременному воздействию РФ-лифтинга (1МГц) и вакуумного массажа. Насадка так же снабжена функцией фотонотерапии. Насадка ультразвуковой кавитации 40КГЦ.   <span style=""font-family: arial black,avant garde;"">Насадка рф-лифтинга и вакуумного массажа для лица:   обеспечивает одновременное воздействие вакуума и радиоволн, что приводит к эффекту омоложения лица в кратчайшие сроки. Процедура ускоряет движение лимфы и крови, активизирует обменные процессы и транспортировку питательных веществ к тканям. Все насадки аппарата позволяют проводить процедуры комфортно и безболезненно, а главное эффективно.  Номер сертификата соответствия  № РОСС CN.HB61.H29322 Номер декларации соответствия ЕАЭС N RU Д-CN.РА01.В.56589/21  ",299000.00,d073a7803be733cd4bc927a44d80378f,470fa75181cd1c623a91af40242bf7cd,38ba31ec3d2d44a4948639a19012eaf9
739,Аппарат Анкор V8-C2 (AnchorFree)," Аппарат - Анкор V8-C2  представляет собой универсальный косметологический аппарат, который включает все основные методы воздействия на кожу и жировую прослойку. Обеспечивает лифтинг кожи, липосакцию жировых подкожных отложений, восстановление упругости и гладкости даже самых проблематичных участков на теле. Модель V8C2 гораздо мощнее и имеет большую производительность, чем предыдущая модель-Анкор V8C1. И это дает еще больше возможностей. Так же большим плюсом является возможность самостоятельного обслуживания системы фильтрации (промывка шлангов)  Особенностью  аппарата вакуумно-роликовой коррекции фигуры является то, что он совмещает в себе 5 основных технологий воздействия, каждая из которых выполняет свою определенную функцию. - При этом каждая из них взаимо дополняет другую и повышает эффективность процедур.  Функции аппарата:  вакуумный массаж механические ролики инфракрасный свет RF - лифтинг ультразвуковая вакуумная - кавитация  Показания:  удаление темных кругов вокруг глаз, уменьшение и удаление морщин вокруг глаз; улучшение контуров век и уменьшение мешков под глазами; подтяжка кожи и удаление морщин в области век; коррекция контуров тела после родов; улучшение контуров тела, уменьшение объема талии; избыточный вес, локальные жировые отложения, подтяжка кожи (на руках, ногах, плечах и спине, бедрах и ягодицах); уменьшение боли при артрите, лечебный массаж тела; увеличение упругости кожи; коррекция контуров тела; локальное лечение жировых отложений в проблемных зонах; сглаживание последствий от хирургической липосакции.  Преимущества Анкор от других вакуумных аппаратов:  -Вакуумная ультразвуковая кавитация нового поколения. Ультразвук не затрагивает органы, тем самым обеспечивает полную безопасность для клиента. -С помощью автоматического - пульсирующего вакууманого захвата складки - одновременно разрушаются жировые клетки и обеспечивается дренаж. -Сочетание пяти эффективных методик в одном аппарате, что многократно повышает эффективность работы. -Применяемые технологии являются не инвазивными. -Видимый результат после первой процедуры. -Ощутимое уменьшение объемов тела -Ярко выраженный лифтинг кожи лица и тела.  Описание методик:  Ультразвуковое воздействие   Безвредный звук с частотой 40 кГц способен вызывать колебания мембраны жировых клеток. Образуются крошечные воздушные пузырьки, что разрушают клетку изнутри. Таким образом, триглицериды и другие вещества постепенно с помощью лимфатического дренажа выводятся из-под кожи. -   Инфракрасное излучение  Для точности подачи этого спектра используется луч. Настроив его на конкретную длину волны можно воздействовать на жировую прослойку в глубине тканей. При этом соседние участки кожи не будут подвергаться излучению. Инфракрасный свет разогревает липоциты, приводя к усилению обмена веществ между кровяным руслом, клеткой и межклеточным пространством. Из липоцитов выходит вода и жирные кислоты. При этом размеры клетки значительно уменьшаются, а жировая прослойка утончается. -   -  Радиолифтинг  Процедура подтяжки кожи путем воздействия радиочастотного излучения. Методика позволяет эффективно восстанавливать упругость кожи и бороться с такими негативными проявлениями старения лица, как морщины, дряблость, расширенные поры. Направленное действие электромагнитного излучения вызывает разогрев глубоких слоев эпидермиса. В результате происходит разрушение старых волокон коллагена и стимулируется выработка новых.  Вакуумный массаж  Применяется в качестве вспомогательного средства для улучшения проницаемости кожи для радиоволн и лазера. С помощью такого приспособления манипулятор растягивает тонкие волокна в сетчатом слое дермы и позволяет равномерно распределить воздействие ультразвука, инфракрасного излучения.  Массаж роликами  Большие насадки оснащены двумя роликами со спиральным рельефом. Он позволяет механически воздействовать на кожу и подкожную жировую клетчатку, улучшать кровообращение и лимфоотток от конкретного участка. Кроме того, массаж действует успокаивающе и делает процедуру не только эффективной, но и приятной.  Номер сертификата соответствия  № РОСС CN.HB61.H15849  ",520000.00,3cfc250426a2fb99e8affcdc58b37401,67eab3f722abca5db43775a22c72ede2,41f2a708b4328ccfaff3f040a5b8ce3c
740,Аппарат Анкор V8-e," Аппарат Анкор V8 Е  - представляет собой универсальный косметологический аппарат, который включает все основные методы воздействия на кожу и жировую прослойку. Обеспечивает лифтинг кожи, липосакцию жировых подкожных отложений, восстановление упругости и гладкости даже самых проблематичных участков на теле.  Особенностью  аппарата вакуумно-роликовой коррекции фигуры является то, что он совмещает в себе вакуумно роликовое воздействие, радиолифтинг и EMS технологию.  Функции аппарата:  вакуумный массаж механические ролики в большой манипуле по телу RF - лифтинг Технология EMS :  микротоки воздействуют на кожу и повышают клеточную активность. Ускоряется процесс метаболизма. Пигментация становится менее заметной. Во время воздействия биологических микротоков повышается активность клеток дермы, стимулируется выработка АТФ. АТФ ускоряет синтез коллагена.   Показания:  удаление темных кругов вокруг глаз, уменьшение и удаление морщин вокруг глаз; улучшение контуров век и уменьшение мешков под глазами; подтяжка кожи и удаление морщин в области век; коррекция контуров тела после родов; улучшение контуров тела, уменьшение объема талии; избыточный вес, локальные жировые отложения, подтяжка кожи (на руках, ногах, плечах и спине, бедрах и ягодицах); уменьшение боли при артрите, лечебный массаж тела; увеличение упругости кожи; коррекция контуров тела; локальное лечение жировых отложений в проблемных зонах; сглаживание последствий от хирургической липосакции.   Радиолифтинг  Процедура подтяжки кожи путем воздействия радиочастотного излучения. Методика позволяет эффективно восстанавливать упругость кожи и бороться с такими негативными проявлениями старения лица, как морщины, дряблость, расширенные поры. Направленное действие электромагнитного излучения вызывает разогрев глубоких слоев эпидермиса. В результате происходит разрушение старых волокон коллагена и стимулируется выработка новых.  Вакуумный массаж  Применяется в качестве вспомогательного средства для улучшения проницаемости кожи для радиоволн и лазера. С помощью такого приспособления манипулятор растягивает тонкие волокна в сетчатом слое дермы и позволяет равномерно распределить воздействие ультразвука, инфракрасного излучения.  Массаж роликами  Большие насадки оснащены двумя роликами со спиральным рельефом. Он позволяет механически воздействовать на кожу и подкожную жировую клетчатку, улучшать кровообращение и лимфоотток от конкретного участка. Кроме того, массаж действует успокаивающе и делает процедуру не только эффективной, но и приятной.",450000.00,24e53b7bc2965a73f9938d562fab119a,e6b4cbe797cf66fa5778423c855f7b90,a3c316b453b89e57db671ee2e63c402e
741,Аппарат Анкор V8-C1 (Anchor),"Коррекция фигуры по методике Vela Shape-это вакуумный массаж с применением радиочастотных волн и инфракрасного излучения, с помощью которых запускаются все обменные процессы в организме, улучшается циркуляция крови, за счет чего и происходит расщепления жировых клеток.  В аппарате - Анкор применяется УЗ-кавитация нового поколения:  -Автоматический пульсирующий захват складки -Обеспечивает полную безопасность для клиента - ульразвук не затрагивает органы; -Высокая эффективность - двусторонняя обработка зоны; -Позволяет одновременно разрушать жировые клетки и обеспечивать дренаж с помощью пульсирующего вакуума; -Делает работу косметолога простой и комфортной за счет отсутствия шума и необходимости работать ""в складку"". Манипула имеет рабочую поверхность 90&times;120 мм. Подходит для использования на широких участках тела: бедрах, ягодицах и животе. Увеличивается лимфодренаж, стимулируется циркуляция крови, оказывается липолитическое воздействие на жировые клетки.  Массаж Vela Shape помогает устранить следующие проблемы:  -целлюлит -локальные жировые отложения в области талии, живота, бёдер и т.д -слабый тонус мышц -дряблость кожи  Комплектиция манипул:   1. Большая (по телу): ролик-вакуум, RF, ИК излучение - площадь обработки: 40 х 66мм  - кнопки управления параметрами на манипуле  - дисплей 2,4""  2. Средняя (тело,руки,ноги): вакуум, RF, ИК излучение  - площадь обработки: 30 х 44мм  - кнопки управления параметрами на манипуле  - дисплей 1,9""  3. Малая (лицо): вакуум, RF, ИК излучение  насадки с разными площадями обработки: 4 х 7мм; 6 х 13мм;8 х 25мм  4. Ультразвуковая кавитация с пульсирующим вакуумным захватом  - площадь обработки: 90 х 120 мм Длительность импульса: 0.5с-7.5с  Номер сертификата соответствия  № РОСС CN.HB61.H15849  ",470000.00,029a91a5561895c145b4cc003e0d87d1,6a3e186edebf0bc766083a38cca70570,0d80658e7d85f075adbba045d7f47798
742,Аппарат Анкор V8C2+ (Anchor),"Обновленный аппарат - с вакуумно роликовым воздействием, радиолифтинг и EMS технология.  Аппарат - Анкор V8 - C2+  - представляет собой универсальный косметологический аппарат, который включает все основные методы воздействия на кожу и жировую прослойку. Обеспечивает лифтинг кожи, липосакцию жировых подкожных отложений, восстановление упругости и гладкости даже самых проблематичных участков на теле.  Особенностью  аппарата вакуумно-роликовой коррекции фигуры является то, что он совмещает в себе вакуумно роликовое воздействие, радиолифтинг и EMS технологию.  Особенностью  аппарата вакуумно-роликовой коррекции фигуры является то, что он совмещает в себе - 6 основных технологий воздействия, каждая из которых выполняет свою определенную функцию. - При этом каждая из них взаимо дополняет другую и повышает эффективность процедур.  Функции аппарата:  вакуумный массаж механические ролики инфракрасный свет RF - лифтинг ультразвуковая вакуумная - кавитация EMS технология Технология EMS:  микротоки воздействуют на кожу и повышают клеточную активность. Ускоряется процесс метаболизма. Пигментация становится менее заметной. Во время воздействия биологических микротоков повышается активность клеток дермы, стимулируется выработка АТФ. АТФ ускоряет синтез коллагена.",590000.00,b186250e41dac550a54bc252b825eb30,4752fea3e27084011cdee78525e201fe,8a3b79f88687728076715b3e866454d1
743,Аппарат для трансдермальной мезотерапии+микротоки Hello Face," Неинвазивный аппарат для увлажнения кожи лица с 2 манипулами. Используется для любого типа кожи, без возрастных ограничений, не требует периода реабилитации. Функции аппарата:  1.Трансдермальная мезотерапия.  Используемые сыворотки проникают глубоко в кожу за счёт высокого давления кислорода и - высокой скорости введения микрочастиц, действующие вещества проникают в кожу (до 3,5мм) и запускают процесс регенерации. 2. Технология (CLIP) бионический зажим  и система микротоков (EMS) для стимуляции и омоложения кожи. Бионические зажимы разминают кожу активируя ткани и клетки, стимулируя выработку коллагена, -  - эластичных волокон и гиалуроновой кислоты, усиливая микроциркуляцию и ускоряя метаболизм. Такое воздействие помогает эффективно устранять отеки, способствует выделению глубоких токсинов, мобилизует клеточную активность, активирует спящие клетки, снимает усталость глаз и делает кожу глаз более упругой, гладкой и подтянутой.  Результаты процедур:  -гладкая сияющая кожа -сокращение морщин -глубокое увлажнение и лифтинг-эффект -ровный тон и текстура кожи -лимфодренаж -профилактика преждевременного старения -осветление пигментных пятен -эффективная борьба с акне -устранение зуда, воспалений, раздражений -восстановление кожи после агрессивных косметологических процедур Метод трансдермальной доставки ионизированных или заряженных молекул путем генерации необходимого для их движения перепада напряжения между электродами при прохождении постоянного или переменного электрического тока через электролитический раствор, содержащий молекулы, подлежащие доставке.  КОМПЛЕКТАЦИЯ:  Основной блок Кабель питания Манипула с бионическим зажимом Манипула с распылителем микрочастиц  Номер сертификата соответствия  № РОСС CN.HB61.H29322  Номер декларации соответствия ЕАЭС N RU Д-CN.РА01.В.56589/21  ",70000.00,ea80ccbd9b0fb5cbd1aad66f07d4279e,ac16ef94c5d6d8c19a99899a34ee3da1,23837aa2e0b373cea5bcbb472b934a13
